{
  "meta": {
    "subject": "微生物學與臨床微生物學（包括細菌與黴菌）— 培養基成分與適用菌種大綱",
    "version": "1.0.1",
    "updated": "2026-06-18",
    "source": "BD BBL/Difco Manual（2nd ed.）、Oxoid/Thermo Fisher Culture Media Manual（成分比例）；Mahon Textbook of Diagnostic Microbiology、Murray Medical Microbiology（鑑定原理）；考選部醫檢師考題（民國 102–115 年）",
    "media_types": ["基礎／增菌", "含血／苛養", "選擇兼鑑別（腸道）", "G+ 選擇", "鑑別生化管", "分枝桿菌", "特殊／類白喉", "黴菌", "藥敏（MHA）"]
  },
  "flows": {
    "基礎／增菌": [
      "**基礎(basal)**：一般非苛養菌通用（Nutrient agar、TSA）；**增菌(enriched)**：補血/腦心浸液供苛養菌（BHI）。",
      "**增菌液(enrichment broth)**：偏向目標菌——Selenite F／Tetrathionate／GN（Salmonella·Shigella）、Alkaline peptone water（弧菌）、Thioglycollate（厭氧/微需氧、含氧化還原梯度）。"
    ],
    "含血／苛養": [
      "綿羊血 BAP：看溶血（α/β/γ）；不長者(Haemophilus、Neisseria、Legionella)改用巧克力或特殊盤。",
      "巧克力（加熱血→釋出 X hemin + V NAD）→ Haemophilus、Neisseria；Thayer-Martin（VCN）→ 致病性 Neisseria；BCYE（cysteine+鐵）→ Legionella；Bordet-Gengou→ 百日咳。"
    ],
    "選擇兼鑑別（腸道）": [
      "糞便 → 低選擇性盤（**MacConkey / EMB**：乳糖發酵分流）＋ 中～高選擇性盤（**XLD / HE / SS**：Salmonella·Shigella）",
      "疑似 **霍亂/海產相關弧菌** → 鹼性 **TCBS**（pH 8.6）；疑似 **Yersinia** → **CIN**（25–28℃，牛眼菌落）"
    ],
    "G+ 選擇": [
      "抑制 G(−)、留 G(+)：MSA（7.5% NaCl，葡萄球菌）、CNA／PEA（鏈球菌·葡萄球菌，可看溶血）。",
      "Bile esculin（+6.5% NaCl）→ 區分 group D 鏈球菌 / 腸球菌。"
    ],
    "鑑別生化管": [
      "TSI/KIA：醣發酵（斜面/底）＋ H₂S＋產氣；Urea：尿素酶；SIM：H₂S/indole/移動性；Simmons citrate：檸檬酸單一碳源。",
      "酚紅(TSI/KIA/Urea) vs 溴瑞香草酚藍(Simmons citrate) 為常考指示劑對比。"
    ],
    "分枝桿菌": [
      "蛋基 LJ（malachite green 抑雜菌，初代分離）vs 瓊脂 7H10/7H11（+OADC，較早判讀、藥敏比例法）。"
    ],
    "特殊／類白喉": [
      "白喉桿菌：Loeffler 血清斜面（增殖＋異染顆粒）→ Cystine-tellurite／Tinsdale（還原 tellurite 呈灰黑、Tinsdale 棕暈）。"
    ],
    "黴菌": [
      "Sabouraud dextrose agar（pH 5.6，真菌通用）；加 chloramphenicol+cycloheximide＝Mycosel（抑菌+腐生黴）；CHROMagar Candida 依顏色分種；PDA 促孢子/色素。"
    ],
    "藥敏（MHA）": [
      "Kirby-Bauer 紙錠擴散標準盤；苛養菌加 5% 綿羊血或溶解馬血(+NAD)；酵母菌用 RPMI 1640。"
    ]
  },
  "media": [
    {
      "h1": "基礎／增菌", "type": "base", "abbr": "NA", "en": "Nutrient Agar", "zh": "營養瓊脂", "stars": 1,
      "comp": [["Beef extract 牛肉萃取物","3 g/L","氮源"],["Peptone 蛋白腖","5 g/L","氮源"],["Sodium chloride 氯化鈉","5 g/L","滲透"],["Agar 洋菜","15 g/L","凝固劑"]],
      "ph": "6.8 ± 0.2 (25℃)", "steril": "121℃ 高壓滅菌 15 分鐘",
      "principle": "**基礎培養基**：只提供基本碳氮源與鹽分，供一般非苛養菌生長；**無選擇劑、無指示劑**。去掉洋菜即為 Nutrient broth。",
      "appear": "一般菌呈乳白／灰白圓形菌落；不溶血、不變色。",
      "species": [["Escherichia coli","可生長"],["Staphylococcus aureus","可生長"],["Bacillus subtilis","可生長"]],
      "hot": ["**基礎/通用培養基代表**，無選擇或鑑別功能。","苛養菌(Haemophilus/Neisseria/Streptococcus 等)在 NA 上**長不好**，需增菌或含血盤。"],
      "qa": [["概念","基礎培養基:僅供一般菌生長,無選擇劑/指示劑;與選擇、鑑別、增菌培養基對比"]]
    },
    {
      "h1": "基礎／增菌", "type": "base", "abbr": "TSA", "en": "Trypticase Soy Agar", "zh": "胰酶大豆瓊脂", "stars": 2,
      "comp": [["Pancreatic digest of casein 酪蛋白胰酶消化物","15 g/L","氮源"],["Papaic digest of soybean meal 大豆木瓜酶消化物","5 g/L","氮源"],["Sodium chloride 氯化鈉","5 g/L","滲透"],["Agar 洋菜","15 g/L","凝固劑"]],
      "ph": "7.3 ± 0.2 (25℃)", "steril": "121℃ 高壓滅菌 15 分鐘",
      "principle": "**營養豐富的通用基礎盤**：雙重蛋白腖供大多數細菌（含部分苛養菌）生長；常作為**血液瓊脂的基底**（+5% 綿羊血）。",
      "appear": "多數菌生長良好；加血後可觀察溶血。",
      "species": [["Staphylococcus","可生長"],["Streptococcus","加血生長較佳"],["Enterobacterales","可生長"]],
      "hot": ["TSA 常作為 **Blood agar 的基底**；TSB（湯）為常用一般增菌液。","115 年題:**trypticase soy broth 不是** Salmonella/Shigella 的選擇性增菌液(對比 selenite/tetrathionate/GN)。"],
      "qa": [["115年 第3題","下列何者不是 Salmonella/Shigella 增菌液(TSB 為選項,非增菌)"]]
    },
    {
      "h1": "基礎／增菌", "type": "base", "abbr": "BHI", "en": "Brain Heart Infusion", "zh": "腦心浸液", "stars": 2,
      "comp": [["Calf brain infusion solids 小牛腦浸出物","7.7 g/L","氮源／生長因子"],["Beef heart infusion solids 牛心浸出物","9.8 g/L","氮源／生長因子"],["Proteose peptone 蛋白腖","10 g/L","氮源"],["Dextrose 葡萄糖","2 g/L","碳源"],["Sodium chloride 氯化鈉","5 g/L","滲透"],["Disodium phosphate 磷酸氫二鈉","2.5 g/L","緩衝"],["Agar（製盤時）洋菜","13.5 g/L","凝固劑"]],
      "ph": "7.4 ± 0.2 (25℃)", "steril": "121℃ 高壓滅菌 15 分鐘",
      "principle": "**高營養增菌培養基**：腦、心浸出物供苛養菌與真菌生長；常用於血液培養、鏈球菌/酵母菌增殖與保存。",
      "appear": "苛養菌、酵母菌皆生長良好。",
      "species": [["Streptococcus pneumoniae","生長良好"],["Candida","可生長"],["血液培養常見菌","廣泛支持"]],
      "hot": ["**高營養增菌**代表；可培養苛養菌與真菌。","CLSI Candida 紙錠擴散(M44)曾以 **BHI+2% glucose** 為選項之一。"],
      "qa": [["106年 第58題","Candida 紙錠擴散培養基(BHI+2% glucose 為選項)"]]
    },
    {
      "h1": "基礎／增菌", "type": "base", "abbr": "Thio", "en": "Fluid Thioglycollate Medium", "zh": "硫醇乙酸鹽液體培養基", "stars": 2,
      "comp": [["Pancreatic digest of casein 酪蛋白胰酶消化物","15 g/L","氮源"],["Yeast extract 酵母萃取物","5 g/L","生長因子"],["Dextrose 葡萄糖","5.5 g/L","碳源"],["Sodium chloride 氯化鈉","2.5 g/L","滲透"],["L-Cystine 胱胺酸","0.5 g/L","生長因子"],["Sodium thioglycollate 硫醇乙酸鈉","0.5 g/L","生長因子"],["Resazurin 試鹵靈","0.001 g/L","指示劑"],["Agar 洋菜","0.75 g/L","凝固劑"]],
      "ph": "7.1 ± 0.2 (25℃)", "steril": "121℃ 高壓滅菌；使用前煮沸驅氧",
      "principle": "**氧化還原梯度增菌液**：thioglycollate＋cystine 降低氧化還原電位、半固態洋菜限制氧擴散，管內由上(有氧)到下(厭氧)形成梯度；**resazurin** 上層粉紅(有氧)、下層無色(厭氧)。",
      "appear": "依需氧性分布：絕對需氧菌長上層、厭氧菌長底部、兼性/微需氧菌全管或特定帶。",
      "species": [["Pseudomonas aeruginosa","上層(需氧)"],["Clostridium","底部(厭氧)"],["Enterobacterales","全管(兼性)"]],
      "hot": ["**指示劑為 resazurin**（粉紅=有氧），不是 phenol red；**thioglycollate/cystine 為還原劑**降低氧化還原電位。","可同時培養需氧、厭氧、微需氧菌，依生長位置判斷需氧性。"],
      "qa": [["105年 第46題","有關 thioglycollate broth 之敘述(可培養需氧/厭氧、resazurin 指示)"],["106年 第46題","加入何者使培養基具較低氧化還原電位(thioglycollate)"]]
    },
    {
      "h1": "基礎／增菌", "type": "base", "abbr": "Selenite F", "en": "Selenite F Broth", "zh": "亞硒酸鹽 F 增菌液", "stars": 2,
      "comp": [["Casitone／Peptone 蛋白腖","5 g/L","氮源"],["Lactose 乳糖","4 g/L","碳源"],["Sodium hydrogen selenite 亞硒酸氫鈉","4 g/L","選擇劑"],["Sodium phosphate 磷酸鈉(緩衝系)","10 g/L","緩衝"]],
      "ph": "7.0 ± 0.2 (25℃)", "steril": "流動蒸氣/沸水浴加熱；**不可高壓滅菌**(亞硒酸鹽會分解)",
      "principle": "**選擇性增菌液**：亞硒酸鹽於培養初期抑制大腸菌群與腸球菌，使 Salmonella（部分 Shigella）相對增殖；增菌後再接種 XLD/HE/SS。",
      "appear": "液體增菌，無菌落判讀；增菌 12–18 小時後轉種選擇盤。",
      "species": [["Salmonella","選擇性增殖(佳)"],["Shigella","部分可增殖"],["大腸菌群","早期被抑制"]],
      "hot": ["**Salmonella/Shigella 前增菌**代表(與 Tetrathionate、GN broth 同類)。","不可高壓滅菌;115 年題以 selenite 為正確增菌液、TSB 為非增菌對比。"],
      "qa": [["115年 第3題","Salmonella/Shigella 增菌液(selenite 為正確,TSB 非增菌)"]]
    },
    {
      "h1": "基礎／增菌", "type": "base", "abbr": "APW", "en": "Alkaline Peptone Water", "zh": "鹼性蛋白腖水", "stars": 1,
      "comp": [["Peptone 蛋白腖","10 g/L","氮源"],["Sodium chloride 氯化鈉","10 g/L","滲透"]],
      "ph": "**8.4–8.6（鹼性）**", "steril": "121℃ 高壓滅菌 15 分鐘",
      "principle": "**弧菌選擇性增菌液**：高 pH 8.6 利於耐鹼的 Vibrio 快速增殖、抑制多數腸內菌；增菌 6–8 小時後轉種 TCBS。",
      "appear": "表面薄膜(pellicle)生長(弧菌好氧、嗜鹼);液體增菌無菌落。",
      "species": [["Vibrio cholerae","表面增殖(佳)"],["Vibrio parahaemolyticus","增殖(可加 1% NaCl)"]],
      "hot": ["**弧菌專用增菌液**，pH 8.6 與 TCBS 同走鹼性策略。","常與 TCBS 搭配:APW 增菌 → TCBS 分離。"],
      "qa": [["概念","弧菌前增菌:鹼性蛋白腖水(pH 8.6)→ 再轉種 TCBS"]]
    },
    {
      "h1": "含血／苛養", "type": "blood", "abbr": "BAP", "en": "Blood Agar (5% Sheep Blood)", "zh": "血液瓊脂(5%綿羊血)", "stars": 3,
      "comp": [["TSA/Columbia base 蛋白腖基底","≈ 40 g/L","氮源"],["Sodium chloride 氯化鈉","5 g/L","滲透"],["Agar 洋菜","15 g/L","凝固劑"],["Defibrinated sheep blood 去纖維綿羊血","50 mL/L (5%)","生長因子"]],
      "ph": "7.3 ± 0.2 (25℃)", "steril": "基底 121℃ 滅菌，冷卻至約 50℃ 再加入無菌綿羊血",
      "principle": "**增菌＋鑑別(溶血)**：血液供苛養菌生長；依菌分泌之溶血素分 **α(草綠)／β(完全透明)／γ(不溶血)**。綿羊血用於抑制 Haemophilus haemolyticus 的偽溶血。",
      "appear": "α：菌落周圍草綠色；β：透明清澈溶血環；γ：無變化。",
      "species": [["Streptococcus pyogenes","β 溶血"],["Streptococcus pneumoniae","α 溶血、臍狀凹陷"],["Staphylococcus aureus","β 溶血、金黃"],["Enterococcus","多為 γ"]],
      "hot": ["**判溶血型(α/β/γ)的標準盤**；用**綿羊血**(非馬血,避免 Haemophilus 偽溶血)。","部分菌在 BAP **長不好/不長**:Neisseria gonorrhoeae、Haemophilus influenzae、Legionella、Francisella、披衣菌(細胞內,完全不長)。"],
      "qa": [["115年 第45題","下列何者無法培養於 blood agar(Chlamydia trachomatis)"],["112年 第79題","在 BAP 通常無法生長者(Neisseria gonorrhoeae)"]]
    },
    {
      "h1": "含血／苛養", "type": "blood", "abbr": "Choc", "en": "Chocolate Agar", "zh": "巧克力瓊脂", "stars": 3,
      "comp": [["GC II / BHI agar base 基底","≈ 36 g/L","氮源"],["Hemoglobin 血紅素(提供 X 因子 hemin)","10 g/L","生長因子"],["IsoVitaleX/CVA 補充劑(提供 V 因子 NAD)","10 mL/L","生長因子"],["Sodium chloride 氯化鈉","5 g/L","滲透"],["Agar 洋菜","12 g/L","凝固劑"]],
      "ph": "7.2 ± 0.2 (25℃)", "steril": "基底滅菌後於約 80℃ 加血加熱(血球破裂釋出因子→巧克力色)",
      "principle": "**增菌(苛養)**：加熱使紅血球破裂、釋出 **X 因子(hemin)與 V 因子(NAD)**，供 Haemophilus、Neisseria 生長(這些菌在一般 BAP 長不好)。",
      "appear": "棕褐(巧克力)色不透明盤；Haemophilus 呈灰白色細小菌落。",
      "species": [["Haemophilus influenzae","灰白色小菌落(需 X+V)"],["Neisseria gonorrhoeae","可生長(需巧克力/強化)"],["Neisseria meningitidis","可生長"]],
      "hot": ["**提供 X(hemin)+V(NAD)** 給 Haemophilus／Neisseria 是核心；加熱血→巧克力色。","H. influenzae 在綿羊血 BAP 長不好(V 因子被血球內 NADase 分解)，故需巧克力盤。"],
      "qa": [["115年 第61題","CSF:BAP 不長、巧克力長灰白小菌落、需 X+V→ H. influenzae"],["111年 第25題","最適培養 Haemophilus 之培養基(含血/巧克力供 X·V)"]]
    },
    {
      "h1": "含血／苛養", "type": "blood", "abbr": "TM", "en": "Modified Thayer-Martin Agar (VCN)", "zh": "改良式塞耶-馬丁瓊脂", "stars": 3,
      "comp": [["Chocolate(GC base+hemoglobin+IsoVitaleX) 巧克力基底","—","生長因子"],["Vancomycin 萬古黴素","3 mg/L","選擇劑(抗生素)"],["Colistin 克痢黴素","7.5 mg/L","選擇劑(抗生素)"],["Nystatin 制黴菌素","12.5 mg/L","選擇劑(抗生素)"],["Trimethoprim 三甲氧苄啶(改良式)","5 mg/L","選擇劑(抗生素)"]],
      "ph": "7.2 ± 0.2 (25℃)", "steril": "巧克力基底滅菌後加入無菌抗生素補充劑",
      "principle": "**選擇性巧克力盤**：在巧克力上加 **VCN**——Vancomycin 抑 G(+)、Colistin 抑 G(−)、Nystatin 抑真菌(改良式再加 Trimethoprim 抑 Proteus)；專分離致病性 Neisseria。",
      "appear": "Neisseria 灰白色菌落；雜菌大多被抑制。",
      "species": [["Neisseria gonorrhoeae","選擇性生長"],["Neisseria meningitidis","選擇性生長"]],
      "hot": ["**VCN = Vancomycin + Colistin + Nystatin**(改良式 +Trimethoprim)，分離致病性 Neisseria。","屬選擇性培養基(考題常以 Thayer-Martin 為選擇性盤代表)。"],
      "qa": [["104年 第5題","下列何者為選擇性培養基(Thayer-Martin)"]]
    },
    {
      "h1": "含血／苛養", "type": "blood", "abbr": "BG", "en": "Bordet-Gengou Agar", "zh": "波德-江古瓊脂", "stars": 2,